{
  "$schema": "http://json-schema.org/draft-07/schema#",
  "$id": "https://github.com/alexandermattturner/agent-sandbox/schema/workload.schema.json",
  "title": "agent-sandbox Workload",
  "description": "The parameterization that replaces a workload-specific bootstrap (e.g. installing an agent). A Workload record is handed to `agent-sandbox run`: the launcher selects a runtime via the backend, allocates a subnet, brings up the name-level-allowlist firewall, waits for its health, then execs the workload's entrypoint. No workload-specific logic lives in the library.",
  "type": "object",
  "additionalProperties": false,
  "required": ["image", "entrypoint", "egress_allowlist", "ephemeral"],
  "properties": {
    "image": {
      "type": "string",
      "minLength": 1,
      "description": "Container image the workload runs (the workload payload, e.g. an agent). Distinct from the firewall image, which the library owns."
    },
    "entrypoint": {
      "type": "array",
      "items": { "type": "string" },
      "minItems": 1,
      "description": "argv the sandbox execs once the firewall is healthy. NO bootstrap/install here — the workload brings its own command."
    },
    "env": {
      "type": "object",
      "description": "name -> value map exported into the workload container. Delivered via a 0600 env-file consumed only while the container is created, then unlinked, so values never persist in the on-disk compose override — but they remain visible on the live container via `docker inspect`; put credentials in secret_env instead. Values must be single-line (the env-file is line-based); a value containing a newline is refused.",
      "additionalProperties": { "type": "string" }
    },
    "secret_env": {
      "type": "object",
      "propertyNames": { "pattern": "^[A-Za-z_][A-Za-z0-9_]*(?![\\s\\S])" },
      "additionalProperties": { "type": "string" },
      "description": "name -> value map of CREDENTIALS, each delivered as a file the workload reads at /run/secrets/<name> (mode 0400, owned by the workload user) — never as an environment variable. Values are streamed over an exec's stdin into a per-container tmpfs after the container is created, so they are invisible to `docker inspect` (no env, no argv, no mount source) and no secret byte ever touches the host state dir or a compose file; the tmpfs dies with the container, so teardown removes the material by construction. The consumer contract is file-based: the workload must read each value from its /run/secrets path. Values may contain newlines and are delivered byte-exact; the tmpfs caps total secret material at 1 MiB. Names must be env-var-shaped; the name pattern ends in (?![\\s\\S]) rather than $ because a name is an in-container path component and Python's re lets a plain $ match before a string-final newline."
    },
    "tty": {
      "type": "boolean",
      "default": false,
      "description": "When true, allocate an interactive TTY for the workload's entrypoint (docker exec -it) and attach the launcher's stdin. Requires the launcher to run from a real terminal; the launch fails loudly if stdin is not a TTY. Default false (non-interactive, e.g. CI)."
    },
    "user": {
      "type": "string",
      "description": "uid or name the workload runs as. Must be unprivileged; the workload container drops ALL capabilities and runs read-only.",
      "default": "1000"
    },
    "workspace_mount": {
      "type": "string",
      "description": "Host path bound to the container's /workspace. Omitted when seed_from_git is set (the workspace is seeded from git into a volume instead of bound)."
    },
    "overmount_paths": {
      "type": "array",
      "items": { "type": "string", "minLength": 1 },
      "default": [".git/hooks", "node_modules"],
      "description": "Workspace-relative paths mounted READ-ONLY on top of the /workspace bind, so the workload can read but never write them. A read-only bind is kernel-enforced (even in-container root can't write it). This is a BIND-MODE guard: in seed mode /workspace is a named volume and the workload's writes are already gated by the review-branch extract, so it has no effect there. `.git/hooks` is a container->host code-execution guard — in bind mode the host checkout is mounted read-write at /workspace, so without this a compromised workload could plant /workspace/.git/hooks/pre-commit that runs ON THE HOST the next time the user invokes git in that checkout, a breakout that outlives the session and never shows in `git diff`. `node_modules` locks the tooling the workload imports so it can't tamper with it. The default applies only when this field is ABSENT; an explicit [] means 'no overmounts'."
    },
    "egress_allowlist": {
      "type": "array",
      "items": {
        "oneOf": [
          { "type": "string", "format": "hostname" },
          {
            "type": "object",
            "additionalProperties": false,
            "required": ["host"],
            "properties": {
              "host": { "type": "string", "format": "hostname" },
              "access": {
                "type": "string",
                "enum": ["ro", "rw"],
                "default": "rw",
                "description": "'rw' (default): all HTTP methods, TLS spliced end-to-end. 'ro': GET/HEAD only, enforced by the proxy decrypting the connection (ssl_bump) — the workload image must trust the sandbox proxy CA for ro hosts."
              }
            }
          }
        ]
      },
      "description": "Allowed destinations as HOSTNAMES, never IPs. A bare string grants full access ('allow this host' means it works); the object form with access:'ro' restricts a host to GET/HEAD. The firewall boots deny-all — a workload reaches ONLY what it declares here. Enforced at the forward proxy (squid CONNECT host check) + a pinned static DNS resolver + an iptables ipset backstop — one mechanism. An IP allowlist is a security regression (CDN over/under-block, rotating IPs, resolver/DoH bypass) AND breaks the tamper-evident egress log."
    },
    "ephemeral": {
      "type": "boolean",
      "description": "When true, the workload's volumes are throwaway and torn down on exit; teardown fails loud on any survivor (the guarantee is verified, not assumed)."
    },
    "seed_from_git": {
      "type": "object",
      "additionalProperties": false,
      "required": ["ref", "review_branch"],
      "description": "worktree-seed: seed the workspace from a git ref inside the sandbox; the workload's writes are extracted onto review_branch on the host, never onto the host working tree.",
      "properties": {
        "ref": {
          "type": "string",
          "description": "The git ref (commit/branch/tag) the sandbox workspace is seeded from."
        },
        "review_branch": {
          "type": "string",
          "description": "The host branch the workload's committed writes land on for review."
        }
      }
    },
    "hardener": {
      "type": "boolean",
      "default": true,
      "description": "Run the transient root hardener init service (default true). It executes every executable in the read-only /run/hardener-hooks.d mount (empty by default = no-op success) to write hardened config into a volume the workload mounts read-only at /run/hardened-config; any hook failure aborts the launch before the workload starts. false opts the service out of the stack entirely."
    },
    "audit": {
      "type": "boolean",
      "default": true,
      "description": "Run the tamper-evident append-only audit sink service (default true). It mints a per-session HMAC secret and chains appended records so edits, reordering, or interior drops are detectable; the workload mounts neither the log nor the secret. false opts the service out of the stack entirely."
    },
    "control_plane": {
      "type": "object",
      "additionalProperties": false,
      "description": "Consumer control-plane attachment (docs/control-plane.md): services a consumer brings via --extra-compose that must be ready before the workload runs, plus per-uid direct-egress carve-outs for them. The workload itself gains nothing from either field.",
      "properties": {
        "require": {
          "type": "array",
          "items": { "type": "string", "pattern": "^[a-z0-9][a-z0-9-]*$" },
          "description": "Names of consumer control-plane services that must signal readiness — by creating /run/control-plane/<name>.ready in the shared control-plane volume — before the workload's entrypoint runs. The launch fails closed on timeout (AGENT_SANDBOX_READY_TIMEOUT seconds, default 60)."
        },
        "egress_grants": {
          "type": "array",
          "items": {
            "type": "object",
            "additionalProperties": false,
            "required": ["uid", "hosts"],
            "properties": {
              "uid": {
                "type": "integer",
                "minimum": 1,
                "description": "The uid the consumer service runs as inside the firewall's network namespace (network_mode: service:firewall). Never 0 — a root grant would carve out the firewall's own daemons."
              },
              "hosts": {
                "type": "array",
                "items": {
                  "type": "string",
                  "format": "hostname",
                  "not": { "pattern": "^[0-9]+\\.[0-9]+\\.[0-9]+\\.[0-9]+$" }
                },
                "minItems": 1,
                "description": "Destinations as HOSTNAMES, never IPs — same doctrine as egress_allowlist (an IP grant over/under-blocks rotating CDN addresses and breaks the name-level audit trail)."
              }
            }
          },
          "description": "Per-uid direct-egress carve-outs for consumer services that share the firewall's network namespace (network_mode: service:firewall). Packets from that uid to those hosts' resolved IPs on 443 are ACCEPTed at the packet layer; everything else about the deny-all posture is unchanged. The workload gains nothing: its uid carries no grant, and grant hosts are NOT added to squid's allowlist (resolution is not reachability)."
        }
      }
    },
    "backend": {
      "type": "string",
      "enum": ["local", "hosted"],
      "default": "local",
      "description": "Runtime backend seam. 'local' runs the Kata->gVisor->runc auto-downgrade ladder on the local Docker engine. 'hosted' (a managed remote sandbox) is a documented interface stub. Every backend MUST enforce the allowlist at a forward proxy and keep the proxy log as the egress log."
    }
  }
}
